{
  "plan_version": 1,
  "source_brief": "做一个 CNC 铝合金电机安装座，底板 90x60x8mm，四角 M5 螺丝固定孔，中心给电机轴预留 22mm 通孔。\n四角外轮廓 R6，顶边 C1 倒角。左右各开一个减重口袋，孔口都要倒角。\n输出 SolidWorks 零件和 STEP，并生成预览审查。",
  "part_family": "cnc_mount",
  "parameters": {
    "unit": "mm",
    "material": "6061 aluminum",
    "base_plate": {
      "length": 90.0,
      "width": 60.0,
      "thickness": 8.0
    },
    "fixed_hole_fastener": "M5",
    "tap_drill_reference": {
      "thread": "M5",
      "tap_drill": 4.2,
      "pitch": 0.8,
      "note": "当前固定孔按 clearance through hole 处理，攻丝孔时使用该底孔参考。"
    },
    "center_hole_diameter": 22.0,
    "corner_fillet": 6.0,
    "edge_chamfer": 1.0
  },
  "features": [
    {
      "name": "BasePlate",
      "type": "base_plate",
      "params": {
        "length": 90.0,
        "width": 60.0,
        "thickness": 8.0
      },
      "required": true
    },
    {
      "name": "OuterCornerFillet",
      "type": "fillet",
      "params": {
        "radius": 6.0,
        "target": "outer_vertical_edges"
      },
      "required": true,
      "fallback": "若圆角求解失败，降级为 R4 或逐边添加。"
    },
    {
      "name": "TopEdgeChamfer",
      "type": "chamfer",
      "params": {
        "distance": 1.0,
        "target": "top_outer_edges"
      },
      "required": true,
      "fallback": "若整圈倒角失败，按边对象分组选择后重试。"
    },
    {
      "name": "CornerMountingHoles",
      "type": "through_hole_pattern",
      "params": {
        "fastener": "M5",
        "clearance_diameter": 5.5,
        "positions_xy": [
          [
            -35.0,
            -20.0
          ],
          [
            35.0,
            -20.0
          ],
          [
            -35.0,
            20.0
          ],
          [
            35.0,
            20.0
          ]
        ]
      },
      "required": true
    },
    {
      "name": "CenterShaftClearance",
      "type": "through_hole",
      "params": {
        "diameter": 22.0,
        "position_xy": [
          0.0,
          0.0
        ]
      },
      "required": true
    },
    {
      "name": "SideLighteningPockets",
      "type": "pocket_pair",
      "params": {
        "count": 2,
        "min_wall": 3.0,
        "min_floor": 2.0,
        "placement": "left_and_right_of_center_hole"
      },
      "required": false,
      "fallback": "若口袋与中心孔或固定孔冲突，缩小口袋或跳过并记录。"
    },
    {
      "name": "HoleMouthChamfers",
      "type": "chamfer",
      "params": {
        "distance": 0.5,
        "target": "all_hole_mouth_edges"
      },
      "required": true
    }
  ],
  "operation_sequence": [
    "close_same_name_documents",
    "new_part",
    "base_plate",
    "outer_fillet_and_chamfer",
    "pockets",
    "through_holes",
    "mouth_chamfers",
    "custom_properties",
    "save_export_review"
  ],
  "assumptions": [
    "四角固定孔默认按矩形孔距布置，边距取 10 mm。",
    "固定孔按通孔处理；若需要攻丝孔，应切换 threaded_hole 特征。",
    "减重口袋保留至少 3 mm 壁厚和 2 mm 底厚。"
  ],
  "risk_register": [
    {
      "risk": "圆角和倒角在复杂孔槽之后求解失败或耗时过长。",
      "mitigation": "按 CNC 子技能顺序先处理外轮廓圆角/倒角，再切孔槽；失败时降低半径并逐边重试。"
    },
    {
      "risk": "孔口边选择不稳定。",
      "mitigation": "枚举 body.GetEdges()，按圆心、半径、顶面高度匹配边对象并用 edge.Select2()。"
    },
    {
      "risk": "输出文件已在 SolidWorks 打开导致 SaveAs 失败。",
      "mitigation": "执行前关闭同名旧文档，保存后检查文件存在和大小。"
    }
  ],
  "review_plan": {
    "expected_outputs": [
      "SLDPRT",
      "STEP",
      "parameters_json",
      "review_report_json",
      "isometric_preview"
    ],
    "views": [
      "isometric",
      "front",
      "top",
      "right"
    ],
    "checks": [
      "expected_outputs_exist",
      "previews_created",
      "previews_not_blank",
      "feature_summary_available",
      "features_include_fillet_chamfer_cut"
    ]
  },
  "solidworks_mapping": [
    {
      "operation": "new_part",
      "preferred_api": "sw_session.SolidWorksSession.new_part",
      "notes": "统一通过 session 管理文档生命周期。"
    },
    {
      "operation": "base_plate",
      "preferred_api": "sw_part.sketch_rectangle + sw_part.extrude_boss",
      "notes": "基础体保持简单草图，避免一开始画复杂圆角轮廓。"
    },
    {
      "operation": "outer_fillet_and_chamfer",
      "preferred_api": "FeatureFillet + InsertFeatureChamfer with edge.Select2",
      "notes": "按对象选边，不依赖 Edge1 或坐标点击。"
    },
    {
      "operation": "save_export_review",
      "preferred_api": "session.save + session.export + sw_review.run_review",
      "notes": "必须生成多视角预览和 review report。"
    }
  ]
}